{
  "simulation_version": "1.0.0",
  "generated_at": "2026-07-13T12:30:47.103402Z",
  "mode": "simulation",
  "source_commit_gate_manifest": "D:\\mep_quotation_pipeline\\feasibility_outputs\\profile_commit_gate\\profile_commit_gate_manifest.json",
  "ready_for_write_to_main_pipeline": false,
  "summary": {
    "simulation_status": "SIMULATION_READY_FOR_REVIEW",
    "total_candidates": 3,
    "simulated_records_count": 3,
    "would_insert_count": 3,
    "would_update_count": 0,
    "would_skip_count": 0,
    "blocked_count": 0,
    "ready_for_real_write": false,
    "ready_for_write_to_main_pipeline": false,
    "reasons_not_ready_for_real_write": [
      "Chưa chuyển đổi biến môi trường và chưa kích hoạt lệnh ghi thật của Phase 2F."
    ]
  },
  "simulated_records": [
    {
      "simulation_record_id": "SIM_REC_0001",
      "write_candidate_id": "WRITE_CANDIDATE_0001",
      "supplier_code": "CHINT",
      "material_code": "NXM-63S",
      "description": "MCCB Chint NXM-63S 3P 25÷63 25",
      "unit": "cái",
      "quantity": 1.0,
      "unit_price": 800000,
      "amount": 800000.0,
      "currency": "VND",
      "write_key": "CHINT|NXM-63S|P3|800000|MCCBCHINTNXM63S3P256325",
      "proposed_action": "INSERT_CANDIDATE",
      "simulated_result": "WOULD_INSERT",
      "source_provenance": "Source PDF: Bảng giá Chint 1-3-2023 ck 50.pdf, Page: 3, Layout: chint_mccb_nxm_nm1, Method: coordinate_column_profiler",
      "evidence_text": "25÷63 25 NXM-63S 800,000",
      "created_from_phase": "Phase 2E Simulation",
      "ready_for_real_write": false
    },
    {
      "simulation_record_id": "SIM_REC_0002",
      "write_candidate_id": "WRITE_CANDIDATE_0002",
      "supplier_code": "CHINT",
      "material_code": "NXM-125S",
      "description": "MCCB Chint NXM-125S 3P 80÷125 25",
      "unit": "cái",
      "quantity": 1.0,
      "unit_price": 860000,
      "amount": 860000.0,
      "currency": "VND",
      "write_key": "CHINT|NXM-125S|P3|860000|MCCBCHINTNXM125S3P801252",
      "proposed_action": "INSERT_CANDIDATE",
      "simulated_result": "WOULD_INSERT",
      "source_provenance": "Source PDF: Bảng giá Chint 1-3-2023 ck 50.pdf, Page: 3, Layout: chint_mccb_nxm_nm1, Method: coordinate_column_profiler",
      "evidence_text": "80 ÷ 125 25 NXM-125S 860,000",
      "created_from_phase": "Phase 2E Simulation",
      "ready_for_real_write": false
    },
    {
      "simulation_record_id": "SIM_REC_0003",
      "write_candidate_id": "WRITE_CANDIDATE_0003",
      "supplier_code": "CHINT",
      "material_code": "NXM-250S",
      "description": "MCCB Chint NXM-250S 3P 160,200,250 35",
      "unit": "cái",
      "quantity": 1.0,
      "unit_price": 1400000,
      "amount": 1400000.0,
      "currency": "VND",
      "write_key": "CHINT|NXM-250S|P3|1400000|MCCBCHINTNXM250S3P160200",
      "proposed_action": "INSERT_CANDIDATE",
      "simulated_result": "WOULD_INSERT",
      "source_provenance": "Source PDF: Bảng giá Chint 1-3-2023 ck 50.pdf, Page: 3, Layout: chint_mccb_nxm_nm1, Method: coordinate_column_profiler",
      "evidence_text": "160,200,250 35 NXM-250S 1,400,000",
      "created_from_phase": "Phase 2E Simulation",
      "ready_for_real_write": false
    }
  ],
  "commit_log": {
    "simulation_id": "SIM_SESSION_2026-07-13T12-30-47-103402Z",
    "generated_at": "2026-07-13T12:30:47.103402Z",
    "total_candidates": 3,
    "would_insert_count": 3,
    "would_update_count": 0,
    "would_skip_count": 0,
    "blocked_count": 0,
    "source_commit_gate_hash": "858d1883f5b3672dff96f6d7d98eb3d48d32f57930d6c3fb5d24532ad6d7f0f9",
    "source_candidate_hash": "28651447e1d09fac7611a350c5bac348aa56960565609b7fce024f9743ff0fe7",
    "ready_for_real_write": false,
    "log_entries": [
      {
        "log_id": "LOG_ENTRY_0001",
        "write_candidate_id": "WRITE_CANDIDATE_0001",
        "write_key": "CHINT|NXM-63S|P3|800000|MCCBCHINTNXM63S3P256325",
        "action": "simulation_insert",
        "result": "WOULD_INSERT",
        "message": "[WARNING: not_checked_against_master_database] Giả lập thêm mới thành công."
      },
      {
        "log_id": "LOG_ENTRY_0002",
        "write_candidate_id": "WRITE_CANDIDATE_0002",
        "write_key": "CHINT|NXM-125S|P3|860000|MCCBCHINTNXM125S3P801252",
        "action": "simulation_insert",
        "result": "WOULD_INSERT",
        "message": "[WARNING: not_checked_against_master_database] Giả lập thêm mới thành công."
      },
      {
        "log_id": "LOG_ENTRY_0003",
        "write_candidate_id": "WRITE_CANDIDATE_0003",
        "write_key": "CHINT|NXM-250S|P3|1400000|MCCBCHINTNXM250S3P160200",
        "action": "simulation_insert",
        "result": "WOULD_INSERT",
        "message": "[WARNING: not_checked_against_master_database] Giả lập thêm mới thành công."
      }
    ]
  },
  "rollback_plan": {
    "rollback_plan_id": "ROLLBACK_PLAN_2026-07-13T12-30-47-103402Z",
    "generated_at": "2026-07-13T12:30:47.103402Z",
    "simulation_id": "SIM_SESSION_2026-07-13T12-30-47-103402Z",
    "rollback_available": true,
    "rollback_scope": "sandbox_only",
    "rollback_actions": [
      {
        "action_id": "ROLLBACK_ACT_0001",
        "target_record_id": "SIM_REC_0001",
        "undo_action": "DELETE",
        "description": "Xóa bản ghi giả lập SIM_REC_0001 đối với write_key CHINT|NXM-63S|P3|800000|MCCBCHINTNXM63S3P256325."
      },
      {
        "action_id": "ROLLBACK_ACT_0002",
        "target_record_id": "SIM_REC_0002",
        "undo_action": "DELETE",
        "description": "Xóa bản ghi giả lập SIM_REC_0002 đối với write_key CHINT|NXM-125S|P3|860000|MCCBCHINTNXM125S3P801252."
      },
      {
        "action_id": "ROLLBACK_ACT_0003",
        "target_record_id": "SIM_REC_0003",
        "undo_action": "DELETE",
        "description": "Xóa bản ghi giả lập SIM_REC_0003 đối với write_key CHINT|NXM-250S|P3|1400000|MCCBCHINTNXM250S3P160200."
      }
    ],
    "note": "Đây chỉ là phương án rollback giả lập được thiết kế trong sandbox. Chưa có bất kỳ ghi dữ liệu thực tế nào được thực thi nên không cần chạy rollback thật."
  }
}
